{
  "planVersion": 1,
  "site": {
    "entryMode": "existing-repository",
    "siteCommit": "1111111111111111111111111111111111111111",
    "wixConfigurationPresent": true
  },
  "current": {
    "tag": "v0.2.1",
    "commit": "877736282def3631a3fad5d368e3098aadac040f",
    "components": [
      "governance",
      "validation",
      "astro-reference"
    ]
  },
  "target": {
    "tag": "v0.3.0",
    "commit": "bb4d0adcd9021b5cd671e13fed46d5498fac4399",
    "components": [
      "governance",
      "validation",
      "astro-reference",
      "site-qa"
    ]
  }
}
